SET default_table_access_method=@amname@;
--
-- Test gp_select_invisible for tables
--
-- Verify that gp_select_invisible=true bypasses the visibility bitmap so
-- that deleted tuples are exposed via both sequential scan and index scan.
-- Also verify that VACUUM (which uses SNAPSHOT_ANY internally) can scan a table
-- index without crashing.
--
-- Sequential scan: deleted rows should be visible when gp_select_invisible=true
CREATE TABLE table_seqscan_invisible_@amname@ (id int, val text);
INSERT INTO table_seqscan_invisible_@amname@
    SELECT i, 'row ' || i FROM generate_series(1, 5) i;
-- Baseline: normal scan returns all 5 rows
SELECT * FROM table_seqscan_invisible_@amname@ ORDER BY id;
 id |  val  
----+-------
  1 | row 1
  2 | row 2
  3 | row 3
  4 | row 4
  5 | row 5
(5 rows)

-- Delete rows with even id (id=2 and id=4)
DELETE FROM table_seqscan_invisible_@amname@ WHERE id % 2 = 0;
-- Normal scan now returns only 3 rows (deleted rows hidden by visimap)
SELECT * FROM table_seqscan_invisible_@amname@ ORDER BY id;
 id |  val  
----+-------
  1 | row 1
  3 | row 3
  5 | row 5
(3 rows)

-- With gp_select_invisible=true, sequential scan bypasses the visimap and
-- returns all 5 physical rows (including deleted ones)
SET gp_select_invisible = true;
SET enable_seqscan = on;
SET enable_indexscan = off;
SET enable_bitmapscan = off;
SELECT count(*) FROM table_seqscan_invisible_@amname@;
 count 
-------
     5
(1 row)

RESET gp_select_invisible;
RESET enable_seqscan;
RESET enable_indexscan;
RESET enable_bitmapscan;
DROP TABLE table_seqscan_invisible_@amname@;
-- Index scan: deleted rows should be visible when gp_select_invisible=true
-- The btree index retains entries for deleted tuples until VACUUM.
-- FetchTuple must also bypass the visimap check when gp_select_invisible=true.
CREATE TABLE table_idxscan_invisible_@amname@ (id int, val text);
INSERT INTO table_idxscan_invisible_@amname@
    SELECT i, 'row ' || i FROM generate_series(1, 5) i;
-- Create a btree index used by the index-scan path
CREATE INDEX table_idxscan_invisible_@amname@_id_idx ON table_idxscan_invisible_@amname@ (id);
-- Delete rows with even id (id=2 and id=4)
DELETE FROM table_idxscan_invisible_@amname@ WHERE id % 2 = 0;
-- Normal index scan returns only 3 rows
SET enable_seqscan = off;
SET enable_indexscan = on;
SET enable_bitmapscan = off;
SELECT count(*) FROM table_idxscan_invisible_@amname@ WHERE id > 0;
 count 
-------
     3
(1 row)

-- With gp_select_invisible=true, index scan follows all index entries and
-- bypasses the visimap check in FetchTuple, exposing all 5 physical rows
SET gp_select_invisible = true;
SELECT count(*) FROM table_idxscan_invisible_@amname@ WHERE id > 0;
 count 
-------
     5
(1 row)

RESET gp_select_invisible;
RESET enable_seqscan;
RESET enable_indexscan;
RESET enable_bitmapscan;
-- VACUUM uses SNAPSHOT_ANY when scanning indexes.  Previously, PAX was passing
-- SNAPSHOT_ANY to catalog lookups, which could cause incorrect behavior.
-- After the fix, catalog lookups use GetCatalogSnapshot instead.
-- Verify VACUUM completes without error on a PAX table with an index.
VACUUM table_idxscan_invisible_@amname@;
DROP TABLE table_idxscan_invisible_@amname@;
