-- ============================================================
-- cagg_union_view.sql
-- Test: F3 — Real-time UNION ALL user view + materialized_only toggle
--       (named after TimescaleDB's cagg_union_view test for consistency)
-- ============================================================
SET optimizer = off;
SET timezone = 'UTC';
DROP EXTENSION IF EXISTS time_series CASCADE;
CREATE EXTENSION time_series;
SET search_path TO public, time_series;
-- Setup: deterministic source table
CREATE TABLE metrics (
    time        TIMESTAMPTZ       NOT NULL,
    tags_id     INT               NOT NULL,
    temperature DOUBLE PRECISION
) DISTRIBUTED BY (tags_id);
INSERT INTO metrics
SELECT '2024-01-01 00:00+00'::timestamptz
        + (hr || ' hour')::interval
        + (m * 5 || ' minute')::interval,
       tid, 20.0 + tid + hr * 0.5 + m * 0.1
FROM generate_series(1, 10) tid,    -- 10 tags
     generate_series(0, 9)  hr,      -- 10 hours
     generate_series(1, 10) m;       -- 10 rows per (tag, hour)
-- 10 × 10 × 10 = 1000 rows; count=10/cell, 100 groups
CREATE MATERIALIZED VIEW cv
WITH (time_series.continuous) AS
  SELECT time_bucket('1 hour'::interval, time) AS bucket,
         tags_id,
         count(*) AS cnt,
         avg(temperature) AS avg_temp
  FROM metrics
  GROUP BY bucket, tags_id;
NOTICE:  continuous aggregate "cv" successfully created
DETAIL:  Materialization table: time_series._mat_cv_1
-- ============================================================
-- RT-01: Default mode is real-time. Before REFRESH, user view
--        returns live-aggregated source data via the direct view branch.
-- ============================================================
\echo '=== RT-01: real-time visibility before REFRESH ==='
=== RT-01: real-time visibility before REFRESH ===
SELECT count(*) AS mat_before_refresh FROM time_series._mat_cv_1;
 mat_before_refresh 
--------------------
                  0
(1 row)

SELECT count(*) AS cv_before_refresh FROM cv;
 cv_before_refresh 
-------------------
               100
(1 row)

-- EXCEPT against live source: should be 0 (UNION ALL matches live query)
SELECT count(*) AS diff_rt01 FROM (
  (  SELECT bucket, tags_id, cnt, avg_temp FROM cv
   EXCEPT
   SELECT time_bucket('1 hour'::interval, time), tags_id,
   count(*), avg(temperature)
   FROM metrics GROUP BY 1, 2)
  UNION ALL
  (SELECT time_bucket('1 hour'::interval, time), tags_id,
   count(*), avg(temperature)
   FROM metrics GROUP BY 1, 2
   EXCEPT
   SELECT bucket, tags_id, cnt, avg_temp FROM cv
   )
) x;
 diff_rt01 
-----------
         0
(1 row)

-- ============================================================
-- RT-02: After REFRESH, EXCEPT = 0 (mat branch contributes, real-time empty)
-- ============================================================
\echo '=== RT-02: after REFRESH EXCEPT = 0 ==='
=== RT-02: after REFRESH EXCEPT = 0 ===
CALL time_series.refresh_continuous_aggregate('cv', NULL, NULL);
SELECT count(*) AS mat_after_refresh FROM time_series._mat_cv_1;
 mat_after_refresh 
-------------------
               100
(1 row)

SELECT count(*) AS diff_rt02 FROM (
  (  SELECT bucket, tags_id, cnt, avg_temp FROM cv
   EXCEPT
   SELECT time_bucket('1 hour'::interval, time), tags_id,
   count(*), avg(temperature)
   FROM metrics GROUP BY 1, 2)
  UNION ALL
  (SELECT time_bucket('1 hour'::interval, time), tags_id,
   count(*), avg(temperature)
   FROM metrics GROUP BY 1, 2
   EXCEPT
   SELECT bucket, tags_id, cnt, avg_temp FROM cv
   )
) x;
 diff_rt02 
-----------
         0
(1 row)

-- ============================================================
-- RT-03: INSERT beyond watermark → visible via real-time branch without REFRESH
-- ============================================================
\echo '=== RT-03: post-REFRESH INSERT visible immediately ==='
=== RT-03: post-REFRESH INSERT visible immediately ===
-- Set watermark to a known past value (scope to cv only)
UPDATE time_series.cagg_watermark
   SET watermark = '2024-01-01 03:00:00+00'::timestamptz
 WHERE cagg_id = (SELECT cagg_id FROM time_series.continuous_agg
                  WHERE user_view_name = 'cv');
-- Insert new data above watermark (bucket=05:00 already had 10 rows for tag=1)
INSERT INTO metrics VALUES ('2024-01-01 05:00+00', 1, 99.0);
-- Verify cnt AND avg_temp for tag=1, bucket=05:00 against hand-calculated values:
--   Original 10 rows: temp = 23.5 + m*0.1 (m=1..10) → sum=240.5, avg=24.05
--   After backfill (temp=99.0): 11 rows, sum=339.5, avg=339.5/11 ≈ 30.863636
SELECT cnt   = 11 AS rt03_cnt_ok,
       round(avg_temp::numeric, 4) = round(339.5/11.0, 4) AS rt03_avg_ok
  FROM cv
 WHERE bucket = '2024-01-01 05:00+00' AND tags_id = 1;
 rt03_cnt_ok | rt03_avg_ok 
-------------+-------------
 t           | t
(1 row)

-- Full EXCEPT against live source: proves ALL aggregate values are correct
-- (round to tolerate MPP partial-agg fp noise)
SELECT count(*) AS diff_rt03 FROM (
  (  SELECT bucket, tags_id, cnt, round(avg_temp::numeric, 10) FROM cv
   EXCEPT
   SELECT time_bucket('1 hour'::interval, time), tags_id,
   count(*), round(avg(temperature)::numeric, 10)
   FROM metrics GROUP BY 1, 2)
  UNION ALL
  (SELECT time_bucket('1 hour'::interval, time), tags_id,
   count(*), round(avg(temperature)::numeric, 10)
   FROM metrics GROUP BY 1, 2
   EXCEPT
   SELECT bucket, tags_id, cnt, round(avg_temp::numeric, 10) FROM cv
   )
) x;
 diff_rt03 
-----------
         0
(1 row)

-- ============================================================
-- RT-04: materialized_only(true) hides live data AND shows stale aggregates
-- ============================================================
\echo '=== RT-04: toggle to mat-only hides live data ==='
=== RT-04: toggle to mat-only hides live data ===
ALTER VIEW cv SET (time_series.materialized_only = true);
-- Same cell, but mat values (stale, pre-backfill):
--   cnt = 10, avg = 240.5/10 = 24.05
SELECT cnt   = 10 AS rt04_cnt_ok,
       round(avg_temp::numeric, 4) = round(240.5/10.0, 4) AS rt04_avg_ok
  FROM cv
 WHERE bucket = '2024-01-01 05:00+00' AND tags_id = 1;
 rt04_cnt_ok | rt04_avg_ok 
-------------+-------------
 t           | t
(1 row)

-- cv must be a perfect mirror of _mat_cv_1
SELECT count(*) AS diff_rt04 FROM (
  (  SELECT bucket, tags_id, cnt, avg_temp FROM cv
   EXCEPT
   SELECT bucket, tags_id, cnt, avg_temp FROM time_series._mat_cv_1)
  UNION ALL
  (SELECT bucket, tags_id, cnt, avg_temp FROM time_series._mat_cv_1
   EXCEPT
   SELECT bucket, tags_id, cnt, avg_temp FROM cv
   )
) x;
 diff_rt04 
-----------
         0
(1 row)

-- ============================================================
-- RT-05: Toggle back to real-time → live aggregates restored
-- ============================================================
\echo '=== RT-05: toggle back to real-time ==='
=== RT-05: toggle back to real-time ===
ALTER VIEW cv SET (time_series.materialized_only = false);
-- Same assertion as RT-03: cnt=11, avg=339.5/11
SELECT cnt   = 11 AS rt05_cnt_ok,
       round(avg_temp::numeric, 4) = round(339.5/11.0, 4) AS rt05_avg_ok
  FROM cv
 WHERE bucket = '2024-01-01 05:00+00' AND tags_id = 1;
 rt05_cnt_ok | rt05_avg_ok 
-------------+-------------
 t           | t
(1 row)

-- Full EXCEPT against live source
SELECT count(*) AS diff_rt05 FROM (
  (  SELECT bucket, tags_id, cnt, round(avg_temp::numeric, 10) FROM cv
   EXCEPT
   SELECT time_bucket('1 hour'::interval, time), tags_id,
   count(*), round(avg(temperature)::numeric, 10)
   FROM metrics GROUP BY 1, 2)
  UNION ALL
  (SELECT time_bucket('1 hour'::interval, time), tags_id,
   count(*), round(avg(temperature)::numeric, 10)
   FROM metrics GROUP BY 1, 2
   EXCEPT
   SELECT bucket, tags_id, cnt, round(avg_temp::numeric, 10) FROM cv
   )
) x;
 diff_rt05 
-----------
         0
(1 row)

-- ============================================================
-- RT-06: pg_get_viewdef shows UNION ALL + cagg_watermark in real-time
--        but simple SELECT in mat-only
-- ============================================================
\echo '=== RT-06: view definition differs by mode ==='
=== RT-06: view definition differs by mode ===
SELECT pg_get_viewdef('cv', true) LIKE '%UNION ALL%' AS has_union_rt,
       pg_get_viewdef('cv', true) LIKE '%cagg_watermark%' AS has_watermark_rt;
 has_union_rt | has_watermark_rt 
--------------+------------------
 t            | t
(1 row)

ALTER VIEW cv SET (time_series.materialized_only = true);
SELECT pg_get_viewdef('cv', true) LIKE '%UNION ALL%' AS has_union_mo,
       pg_get_viewdef('cv', true) LIKE '%cagg_watermark%' AS has_watermark_mo;
 has_union_mo | has_watermark_mo 
--------------+------------------
 f            | f
(1 row)

-- Restore to real-time for later tests
ALTER VIEW cv SET (time_series.materialized_only = false);
-- ============================================================
-- RT-07: catalog materialized_only column reflects current mode
-- ============================================================
\echo '=== RT-07: catalog state after toggle ==='
=== RT-07: catalog state after toggle ===
SELECT materialized_only AS mo_rt FROM time_series.continuous_agg
 WHERE user_view_name = 'cv';
 mo_rt 
-------
 f
(1 row)

ALTER VIEW cv SET (time_series.materialized_only = true);
SELECT materialized_only AS mo_mo FROM time_series.continuous_agg
 WHERE user_view_name = 'cv';
 mo_mo 
-------
 t
(1 row)

ALTER VIEW cv SET (time_series.materialized_only = false);
-- ============================================================
-- RT-08: CREATE with explicit materialized_only=true → simple view from start
-- ============================================================
\echo '=== RT-08: CREATE with materialized_only=true ==='
=== RT-08: CREATE with materialized_only=true ===
CREATE MATERIALIZED VIEW cv_explicit_mo
WITH (time_series.continuous, time_series.materialized_only=true) AS
  SELECT time_bucket('1 hour'::interval, time) AS bucket,
         count(*) AS cnt
  FROM metrics GROUP BY bucket;
NOTICE:  continuous aggregate "cv_explicit_mo" successfully created
DETAIL:  Materialization table: time_series._mat_cv_explicit_mo_2
-- View def should NOT contain UNION ALL
SELECT pg_get_viewdef('cv_explicit_mo', true) LIKE '%UNION ALL%' AS has_union;
 has_union 
-----------
 f
(1 row)

-- Catalog should show true
SELECT materialized_only FROM time_series.continuous_agg
 WHERE user_view_name = 'cv_explicit_mo';
 materialized_only 
-------------------
 t
(1 row)

-- User view empty (no REFRESH, no real-time branch)
SELECT count(*) AS cv_mo_empty FROM cv_explicit_mo;
 cv_mo_empty 
-------------
           0
(1 row)

DROP VIEW cv_explicit_mo CASCADE;
-- ============================================================
-- RT-09: watermark = -infinity → all rows from real-time branch
-- ============================================================
\echo '=== RT-09: watermark -infinity → all realtime ==='
=== RT-09: watermark -infinity → all realtime ===
CREATE TABLE metrics_fresh (time TIMESTAMPTZ NOT NULL, v INT NOT NULL, val FLOAT8)
  DISTRIBUTED BY (v);
INSERT INTO metrics_fresh VALUES
  ('2024-01-01 00:00+00', 1, 10.0),
  ('2024-01-01 01:00+00', 2, 20.0);
CREATE MATERIALIZED VIEW cv_fresh
WITH (time_series.continuous) AS
  SELECT time_bucket('1 hour'::interval, time) AS bucket,
         count(*) AS cnt
  FROM metrics_fresh GROUP BY bucket;
NOTICE:  continuous aggregate "cv_fresh" successfully created
DETAIL:  Materialization table: time_series._mat_cv_fresh_3
-- Verify watermark is -infinity (no REFRESH yet)
SELECT bool_and(watermark = '-infinity'::timestamptz) AS wm_neg_inf
FROM time_series.cagg_watermark
WHERE cagg_id = (SELECT cagg_id FROM time_series.continuous_agg WHERE user_view_name = 'cv_fresh');
 wm_neg_inf 
------------
 t
(1 row)

-- mat table empty
SELECT count(*) AS mat_empty FROM time_series._mat_cv_fresh_3;
 mat_empty 
-----------
         0
(1 row)

-- User view returns source-aggregated data via real-time branch
SELECT count(*) AS cv_fresh_rows FROM cv_fresh;
 cv_fresh_rows 
---------------
             2
(1 row)

-- EXCEPT = 0
SELECT count(*) AS diff_rt09 FROM (
  (  SELECT bucket, cnt FROM cv_fresh
   EXCEPT
   SELECT time_bucket('1 hour'::interval, time), count(*)
   FROM metrics_fresh GROUP BY 1)
  UNION ALL
  (SELECT time_bucket('1 hour'::interval, time), count(*)
   FROM metrics_fresh GROUP BY 1
   EXCEPT
   SELECT bucket, cnt FROM cv_fresh
   )
) x;
 diff_rt09 
-----------
         0
(1 row)

DROP VIEW cv_fresh CASCADE;
DROP TABLE metrics_fresh CASCADE;
-- ============================================================
-- RT-10: After full REFRESH, real-time branch contributes 0 rows
--        (everything materialized, nothing beyond watermark)
-- ============================================================
\echo '=== RT-10: full REFRESH → all from mat branch ==='
=== RT-10: full REFRESH → all from mat branch ===
CALL time_series.refresh_continuous_aggregate('cv', NULL, NULL);
-- All rows served from mat table; count from user view equals count from mat
SELECT count(*) AS cv_total FROM cv;
 cv_total 
----------
      100
(1 row)

SELECT count(*) AS mat_total FROM time_series._mat_cv_1;
 mat_total 
-----------
       100
(1 row)

SELECT count(*) AS diff_rt10 FROM (
  (  SELECT bucket, tags_id, cnt, avg_temp FROM cv
   EXCEPT
   SELECT bucket, tags_id, cnt, avg_temp FROM time_series._mat_cv_1)
  UNION ALL
  (SELECT bucket, tags_id, cnt, avg_temp FROM time_series._mat_cv_1
   EXCEPT
   SELECT bucket, tags_id, cnt, avg_temp FROM cv
   )
) x;
 diff_rt10 
-----------
         0
(1 row)

-- ============================================================
-- RT-11: Empty source table returns 0 rows in both modes
-- ============================================================
\echo '=== RT-11: empty source table ==='
=== RT-11: empty source table ===
CREATE TABLE metrics_empty (time TIMESTAMPTZ NOT NULL, v INT NOT NULL, val FLOAT8)
  DISTRIBUTED BY (v);
CREATE MATERIALIZED VIEW cv_empty
WITH (time_series.continuous) AS
  SELECT time_bucket('1 hour'::interval, time) AS bucket,
         count(*) AS cnt
  FROM metrics_empty GROUP BY bucket;
NOTICE:  continuous aggregate "cv_empty" successfully created
DETAIL:  Materialization table: time_series._mat_cv_empty_4
-- real-time mode, empty source
SELECT count(*) AS cv_empty_rt FROM cv_empty;
 cv_empty_rt 
-------------
           0
(1 row)

ALTER VIEW cv_empty SET (time_series.materialized_only = true);
SELECT count(*) AS cv_empty_mo FROM cv_empty;
 cv_empty_mo 
-------------
           0
(1 row)

DROP VIEW cv_empty CASCADE;
DROP TABLE metrics_empty CASCADE;
-- ============================================================
-- RT-12: Custom bucket alias works correctly in UNION ALL WHERE
-- ============================================================
\echo '=== RT-12: custom bucket alias ==='
=== RT-12: custom bucket alias ===
CREATE TABLE metrics_alias (time TIMESTAMPTZ NOT NULL, v INT NOT NULL, val FLOAT8)
  DISTRIBUTED BY (v);
INSERT INTO metrics_alias VALUES
  ('2024-01-01 00:30+00', 1, 10.0),
  ('2024-01-01 01:30+00', 2, 20.0);
CREATE MATERIALIZED VIEW cv_alias
WITH (time_series.continuous) AS
  SELECT time_bucket('1 hour'::interval, time) AS my_hour,
         count(*) AS n
  FROM metrics_alias GROUP BY my_hour;
NOTICE:  continuous aggregate "cv_alias" successfully created
DETAIL:  Materialization table: time_series._mat_cv_alias_5
-- View def should reference my_hour (the alias) not bucket
SELECT pg_get_viewdef('cv_alias', true) LIKE '%my_hour%' AS alias_in_view;
 alias_in_view 
---------------
 t
(1 row)

-- Data correct
SELECT count(*) AS diff_rt12 FROM (
  (  SELECT my_hour, n FROM cv_alias
   EXCEPT
   SELECT time_bucket('1 hour'::interval, time), count(*)
   FROM metrics_alias GROUP BY 1)
  UNION ALL
  (SELECT time_bucket('1 hour'::interval, time), count(*)
   FROM metrics_alias GROUP BY 1
   EXCEPT
   SELECT my_hour, n FROM cv_alias
   )
) x;
 diff_rt12 
-----------
         0
(1 row)

DROP VIEW cv_alias CASCADE;
DROP TABLE metrics_alias CASCADE;
-- ============================================================
-- RT-13: relkind stays 'v' after mode toggle
-- ============================================================
\echo '=== RT-13: relkind stays v after toggle ==='
=== RT-13: relkind stays v after toggle ===
ALTER VIEW cv SET (time_series.materialized_only = true);
SELECT relkind FROM pg_class WHERE relname = 'cv';
 relkind 
---------
 v
(1 row)

ALTER VIEW cv SET (time_series.materialized_only = false);
SELECT relkind FROM pg_class WHERE relname = 'cv';
 relkind 
---------
 v
(1 row)

-- ============================================================
-- RT-14: set_materialized_only idempotent (same value twice = no-op)
-- ============================================================
\echo '=== RT-14: idempotent toggle ==='
=== RT-14: idempotent toggle ===
ALTER VIEW cv SET (time_series.materialized_only = false);
-- Calling again with same value should be no-op, no error
ALTER VIEW cv SET (time_series.materialized_only = false);
SELECT materialized_only FROM time_series.continuous_agg WHERE user_view_name = 'cv';
 materialized_only 
-------------------
 f
(1 row)

ALTER VIEW cv SET (time_series.materialized_only = true);
ALTER VIEW cv SET (time_series.materialized_only = true);
SELECT materialized_only FROM time_series.continuous_agg WHERE user_view_name = 'cv';
 materialized_only 
-------------------
 t
(1 row)

-- ============================================================
-- RT-15: WHERE filter on bucket propagates through UNION ALL
-- ============================================================
\echo '=== RT-15: WHERE filter on user view ==='
=== RT-15: WHERE filter on user view ===
-- Ensure cv is in real-time mode (RT-14 left it in mat-only)
ALTER VIEW cv SET (time_series.materialized_only = false);
CALL time_series.refresh_continuous_aggregate('cv', NULL, NULL);
-- Set watermark to split data between mat and real-time branches (scope to cv)
UPDATE time_series.cagg_watermark
   SET watermark = '2024-01-01 02:00:00+00'::timestamptz
 WHERE cagg_id = (SELECT cagg_id FROM time_series.continuous_agg
                  WHERE user_view_name = 'cv');
-- Insert some new data above watermark
INSERT INTO metrics VALUES ('2024-01-01 03:00+00', 1, 30.0);
-- Hand-verify the live-branch cell that has the INSERT:
--   bucket=03:00, tag=1: original 10 rows temp=22.5+m*0.1 (m=1..10), sum=230.5
--   plus INSERT temp=30.0 → 11 rows, sum=260.5, avg=260.5/11
SELECT cnt = 11 AS rt15_cnt_ok,
       round(avg_temp::numeric, 4) = round(260.5/11.0, 4) AS rt15_avg_ok
  FROM cv
 WHERE bucket = '2024-01-01 03:00+00' AND tags_id = 1;
 rt15_cnt_ok | rt15_avg_ok 
-------------+-------------
 t           | t
(1 row)

-- Also verify a mat-branch cell (bucket=01:00 < watermark=02:00):
--   10 rows, temp=21.5+m*0.1, sum=220.5, avg=22.05
SELECT cnt = 10 AS rt15_mat_cnt_ok,
       round(avg_temp::numeric, 4) = round(220.5/10.0, 4) AS rt15_mat_avg_ok
  FROM cv
 WHERE bucket = '2024-01-01 01:00+00' AND tags_id = 1;
 rt15_mat_cnt_ok | rt15_mat_avg_ok 
-----------------+-----------------
 t               | t
(1 row)

-- Full EXCEPT for completeness.
-- Round avg to 10 decimal places to tolerate MPP partial-agg fp noise:
-- cv's live branch and the oracle take different execution paths
-- (different WHERE filters), so partial-aggregation merge order may
-- differ in the LSB of double precision.  10 decimals >> fp noise.
SELECT count(*) AS diff_rt15 FROM (
  (  SELECT bucket, tags_id, cnt, round(avg_temp::numeric, 10) AS avg_t FROM cv
   WHERE bucket >= '2024-01-01 01:00+00'
   AND bucket <  '2024-01-01 04:00+00'
   AND tags_id = 1
   EXCEPT
   SELECT time_bucket('1 hour'::interval, time), tags_id,
   count(*), round(avg(temperature)::numeric, 10)
   FROM metrics
   WHERE time >= '2024-01-01 01:00+00'
   AND time <  '2024-01-01 04:00+00'
   AND tags_id = 1
   GROUP BY 1, 2)
  UNION ALL
  (SELECT time_bucket('1 hour'::interval, time), tags_id,
   count(*), round(avg(temperature)::numeric, 10)
   FROM metrics
   WHERE time >= '2024-01-01 01:00+00'
   AND time <  '2024-01-01 04:00+00'
   AND tags_id = 1
   GROUP BY 1, 2
   EXCEPT
   SELECT bucket, tags_id, cnt, round(avg_temp::numeric, 10) AS avg_t FROM cv
   WHERE bucket >= '2024-01-01 01:00+00'
   AND bucket <  '2024-01-01 04:00+00'
   AND tags_id = 1
   )
) x;
 diff_rt15 
-----------
         0
(1 row)

-- ============================================================
-- RT-16: HAVING clause works in real-time mode + after REFRESH
--
-- GROUP BY bucket (no per-tag split): count(*) is total rows per hour.
-- HAVING count(*) > 5 filters out buckets with ≤ 5 rows.
-- ============================================================
\echo '=== RT-16: HAVING clause ==='
=== RT-16: HAVING clause ===
CREATE TABLE metrics_hav (time TIMESTAMPTZ NOT NULL, v INT NOT NULL, val FLOAT8)
  DISTRIBUTED BY (v);
-- bucket=00: 2 rows  (excluded by HAVING > 5)
-- bucket=01: 5 rows  (excluded, boundary)
-- bucket=02: 6 rows  (included, just over threshold)
-- bucket=03: 10 rows (included, well over)
-- bucket=04: 3 rows  (excluded, will be pushed over by backfill later)
INSERT INTO metrics_hav
SELECT '2024-01-01 00:00+00'::timestamptz + (m * 10 || ' minute')::interval,
       m, 10.0 + m FROM generate_series(1, 2) m     -- bucket 00: 2 rows
UNION ALL
SELECT '2024-01-01 01:00+00'::timestamptz + (m * 10 || ' minute')::interval,
       m, 20.0 + m FROM generate_series(1, 5) m     -- bucket 01: 5 rows
UNION ALL
SELECT '2024-01-01 02:00+00'::timestamptz + (m * 5 || ' minute')::interval,
       m, 30.0 + m FROM generate_series(1, 6) m     -- bucket 02: 6 rows
UNION ALL
SELECT '2024-01-01 03:00+00'::timestamptz + (m * 5 || ' minute')::interval,
       m, 40.0 + m FROM generate_series(1, 10) m    -- bucket 03: 10 rows
UNION ALL
SELECT '2024-01-01 04:00+00'::timestamptz + (m * 10 || ' minute')::interval,
       m, 50.0 + m FROM generate_series(1, 3) m;    -- bucket 04: 3 rows
-- Total: 26 rows. HAVING > 5 → bucket 02 (cnt=6), bucket 03 (cnt=10)
CREATE MATERIALIZED VIEW cv_hav
WITH (time_series.continuous) AS
  SELECT time_bucket('1 hour'::interval, time) AS bucket,
         count(*) AS cnt
  FROM metrics_hav GROUP BY bucket HAVING count(*) > 5;
NOTICE:  continuous aggregate "cv_hav" successfully created
DETAIL:  Materialization table: time_series._mat_cv_hav_6
-- Phase 1: Before REFRESH (real-time only, HAVING applied by direct_view)
-- Hand-verify: only 2 buckets pass, with exact counts
SELECT cnt = 6 AS rt16_pre_bucket02_ok FROM cv_hav
 WHERE bucket = '2024-01-01 02:00+00';
 rt16_pre_bucket02_ok 
----------------------
 t
(1 row)

SELECT cnt = 10 AS rt16_pre_bucket03_ok FROM cv_hav
 WHERE bucket = '2024-01-01 03:00+00';
 rt16_pre_bucket03_ok 
----------------------
 t
(1 row)

-- Bucket 00,01,04 must NOT appear
SELECT count(*) AS rt16_excluded_count FROM cv_hav
 WHERE bucket NOT IN ('2024-01-01 02:00+00'::timestamptz,
                       '2024-01-01 03:00+00'::timestamptz);
 rt16_excluded_count 
---------------------
                   0
(1 row)

SELECT count(*) AS diff_rt16_pre FROM (
  (  SELECT bucket, cnt FROM cv_hav
   EXCEPT
   SELECT time_bucket('1 hour'::interval, time), count(*)
   FROM metrics_hav GROUP BY 1 HAVING count(*) > 5)
  UNION ALL
  (SELECT time_bucket('1 hour'::interval, time), count(*)
   FROM metrics_hav GROUP BY 1 HAVING count(*) > 5
   EXCEPT
   SELECT bucket, cnt FROM cv_hav
   )
) x;
 diff_rt16_pre 
---------------
             0
(1 row)

-- Phase 2: After REFRESH (mat branch stores HAVING-filtered result)
CALL time_series.refresh_continuous_aggregate('cv_hav', NULL, NULL);
SELECT count(*) AS mat_hav_rows FROM cv_hav;
 mat_hav_rows 
--------------
            2
(1 row)

SELECT count(*) AS diff_rt16_post FROM (
  (  SELECT bucket, cnt FROM cv_hav
   EXCEPT
   SELECT time_bucket('1 hour'::interval, time), count(*)
   FROM metrics_hav GROUP BY 1 HAVING count(*) > 5)
  UNION ALL
  (SELECT time_bucket('1 hour'::interval, time), count(*)
   FROM metrics_hav GROUP BY 1 HAVING count(*) > 5
   EXCEPT
   SELECT bucket, cnt FROM cv_hav
   )
) x;
 diff_rt16_post 
----------------
              0
(1 row)

-- Phase 3: Backfill pushes bucket=04 across HAVING threshold (3 → 6)
INSERT INTO metrics_hav VALUES
  ('2024-01-01 04:35+00', 4, 64.0),
  ('2024-01-01 04:40+00', 5, 65.0),
  ('2024-01-01 04:45+00', 6, 66.0);
-- bucket=04 now has 6 rows (3 original + 3 backfill) → passes HAVING > 5
CALL time_series.refresh_continuous_aggregate('cv_hav', NULL, NULL);
-- Now 3 buckets should pass
SELECT count(*) AS mat_hav_after_backfill FROM cv_hav;
 mat_hav_after_backfill 
------------------------
                      3
(1 row)

-- Hand-verify the newly-included bucket
SELECT cnt = 6 AS rt16_backfill_ok FROM cv_hav
 WHERE bucket = '2024-01-01 04:00+00';
 rt16_backfill_ok 
------------------
 t
(1 row)

DROP VIEW cv_hav CASCADE;
DROP TABLE metrics_hav CASCADE;
-- ============================================================
-- RT-17: User view usable in JOIN with another table
-- ============================================================
\echo '=== RT-17: JOIN user view with another table ==='
=== RT-17: JOIN user view with another table ===
-- Ensure cv is in real-time mode and fully refreshed for stable JOIN result
ALTER VIEW cv SET (time_series.materialized_only = false);
CALL time_series.refresh_continuous_aggregate('cv', NULL, NULL);
CREATE TABLE tag_info (tags_id INT PRIMARY KEY, label TEXT)
  DISTRIBUTED REPLICATED;
INSERT INTO tag_info VALUES (1, 'sensor-A'), (2, 'sensor-B'), (3, 'sensor-C');
-- JOIN works; result covers both mat and real-time branches
SELECT count(*) AS diff_rt17 FROM (
  (  SELECT cv.bucket, cv.tags_id, cv.cnt, ti.label
   FROM cv JOIN tag_info ti ON cv.tags_id = ti.tags_id
   WHERE ti.tags_id <= 3
   EXCEPT
   SELECT time_bucket('1 hour'::interval, m.time), m.tags_id,
   count(*), ti.label
   FROM metrics m JOIN tag_info ti ON m.tags_id = ti.tags_id
   WHERE ti.tags_id <= 3
   GROUP BY 1, 2, ti.label)
  UNION ALL
  (SELECT time_bucket('1 hour'::interval, m.time), m.tags_id,
   count(*), ti.label
   FROM metrics m JOIN tag_info ti ON m.tags_id = ti.tags_id
   WHERE ti.tags_id <= 3
   GROUP BY 1, 2, ti.label
   EXCEPT
   SELECT cv.bucket, cv.tags_id, cv.cnt, ti.label
   FROM cv JOIN tag_info ti ON cv.tags_id = ti.tags_id
   WHERE ti.tags_id <= 3
   )
) x;
 diff_rt17 
-----------
         0
(1 row)

DROP TABLE tag_info CASCADE;
-- ============================================================
-- RT-18: Real-time mode with DATE time column
-- ============================================================
\echo '=== RT-18: DATE time column ==='
=== RT-18: DATE time column ===
CREATE TABLE metrics_date (day DATE NOT NULL, v INT NOT NULL, val FLOAT8)
  DISTRIBUTED BY (v);
INSERT INTO metrics_date VALUES
  ('2024-01-01', 1, 10.0),
  ('2024-01-02', 2, 20.0),
  ('2024-01-03', 3, 30.0);
CREATE MATERIALIZED VIEW cv_date
WITH (time_series.continuous) AS
  SELECT time_bucket('1 day'::interval, day) AS bucket,
         count(*) AS cnt
  FROM metrics_date GROUP BY bucket;
NOTICE:  continuous aggregate "cv_date" successfully created
DETAIL:  Materialization table: time_series._mat_cv_date_7
-- Before REFRESH: real-time branch returns everything
SELECT count(*) AS diff_rt18 FROM (
  (  SELECT bucket, cnt FROM cv_date
   EXCEPT
   SELECT time_bucket('1 day'::interval, day), count(*)
   FROM metrics_date GROUP BY 1)
  UNION ALL
  (SELECT time_bucket('1 day'::interval, day), count(*)
   FROM metrics_date GROUP BY 1
   EXCEPT
   SELECT bucket, cnt FROM cv_date
   )
) x;
 diff_rt18 
-----------
         0
(1 row)

DROP VIEW cv_date CASCADE;
DROP TABLE metrics_date CASCADE;
-- ============================================================
-- RT-18b: cagg_watermark() must NOT be constant-folded by planner
--
-- If the planner folds cagg_watermark(N) to a constant on QD, all
-- segments would use the same watermark value instead of reading their
-- own local row.  This test verifies that EXPLAIN shows the function
-- call (not a timestamp literal) in the plan's Filter.
--
-- Historical context: the function was originally LANGUAGE SQL STABLE,
-- which PG inlined + constant-folded.  Fixed by changing to LANGUAGE
-- plpgsql VOLATILE — VOLATILE prevents eval_const_expressions from
-- folding it at plan time.
-- ============================================================
\echo '=== RT-18b: cagg_watermark not constant-folded ==='
=== RT-18b: cagg_watermark not constant-folded ===
-- Use cv (real-time mode, already exists from previous tests)
DO $$
DECLARE
    line text;
    has_funcexpr bool := false;
    has_const_ts bool := false;
BEGIN
    FOR line IN
        EXECUTE 'EXPLAIN (costs off) SELECT * FROM cv'
    LOOP
        -- FuncExpr: "cagg_watermark(1)" in Filter
        IF line LIKE '%cagg_watermark(%' THEN has_funcexpr := true; END IF;
        -- Const: a literal timestamp like '2026-04-16 ...' in Filter
        -- (indicates the function was folded)
        IF line LIKE '%Filter:%''202%+%''%timestamp%' THEN has_const_ts := true; END IF;
    END LOOP;
    RAISE NOTICE 'watermark_in_plan: funcexpr=% const_ts=%', has_funcexpr, has_const_ts;
    -- Expected: funcexpr=true, const_ts=false
END $$;
NOTICE:  watermark_in_plan: funcexpr=t const_ts=f
-- Also verify per-segment execution produces correct results
-- (all segments have the same watermark here, but the function IS called locally)
SELECT count(*) AS diff_rt18b FROM (
  (  SELECT bucket, tags_id, cnt, round(avg_temp::numeric, 10) FROM cv
   EXCEPT
   SELECT time_bucket('1 hour'::interval, time), tags_id,
   count(*), round(avg(temperature)::numeric, 10)
   FROM metrics GROUP BY 1, 2)
  UNION ALL
  (SELECT time_bucket('1 hour'::interval, time), tags_id,
   count(*), round(avg(temperature)::numeric, 10)
   FROM metrics GROUP BY 1, 2
   EXCEPT
   SELECT bucket, tags_id, cnt, round(avg_temp::numeric, 10) FROM cv
   )
) x;
 diff_rt18b 
------------
          0
(1 row)

-- ============================================================
-- RT-18c: Per-segment watermark divergence — the ultimate test.
--
-- This verifies the CORE of the per-segment watermark design:
-- when segments have DIFFERENT watermarks, each segment's UNION ALL
-- split is independent, and the combined result is still correct.
--
-- Why this matters: the cagg_watermark() function was originally
-- LANGUAGE SQL STABLE, which PG constant-folded on QD — making ALL
-- segments use the same value.  With LANGUAGE C VOLATILE, each
-- segment reads its own local watermark.
--
-- Why previous tests didn't catch the old bug: they all happened to
-- have identical watermarks across segments (REFRESH updates all
-- uniformly), so constant-folding gave the right answer by luck.
-- ============================================================
\echo '=== RT-18c: per-segment watermark divergence ==='
=== RT-18c: per-segment watermark divergence ===
ALTER VIEW cv SET (time_series.materialized_only = false);
CALL time_series.refresh_continuous_aggregate('cv', NULL, NULL);
-- Verify watermarks are initially uniform after REFRESH
SELECT count(DISTINCT watermark) AS wm_distinct_before
  FROM time_series.cagg_watermark
 WHERE cagg_id = (SELECT cagg_id FROM time_series.continuous_agg
                  WHERE user_view_name = 'cv');
 wm_distinct_before 
--------------------
                  1
(1 row)

-- Deliberately set DIFFERENT watermarks per segment using gp_segment_id
-- Seg0 = 00:00 (very early → mostly live aggregation)
-- Seg1 = 05:00 (middle → mix of mat + live)
-- Seg2 = 09:00 (almost caught up → mostly mat)
UPDATE time_series.cagg_watermark
   SET watermark = '2024-01-01 00:00+00'::timestamptz
                   + (gp_segment_id * interval '4.5 hour')
 WHERE cagg_id = (SELECT cagg_id FROM time_series.continuous_agg
                  WHERE user_view_name = 'cv');
-- Confirm divergence
SELECT count(DISTINCT watermark) AS wm_distinct_after
  FROM time_series.cagg_watermark
 WHERE cagg_id = (SELECT cagg_id FROM time_series.continuous_agg
                  WHERE user_view_name = 'cv');
 wm_distinct_after 
-------------------
                 3
(1 row)

-- The key assertion: EVEN with divergent watermarks, UNION ALL result
-- must match live source aggregation.  Each segment independently
-- splits its data at its own watermark; mat+live on each segment
-- covers its complete time range without gaps or overlaps.
SELECT count(*) AS diff_rt18c FROM (
  (  SELECT bucket, tags_id, cnt, round(avg_temp::numeric, 10) FROM cv
   EXCEPT
   SELECT time_bucket('1 hour'::interval, time), tags_id,
   count(*), round(avg(temperature)::numeric, 10)
   FROM metrics GROUP BY 1, 2)
  UNION ALL
  (SELECT time_bucket('1 hour'::interval, time), tags_id,
   count(*), round(avg(temperature)::numeric, 10)
   FROM metrics GROUP BY 1, 2
   EXCEPT
   SELECT bucket, tags_id, cnt, round(avg_temp::numeric, 10) FROM cv
   )
) x;
 diff_rt18c 
------------
          0
(1 row)

-- Restore uniform watermarks for subsequent tests
CALL time_series.refresh_continuous_aggregate('cv', NULL, NULL);
-- ============================================================
-- RT-19: GRANT preserved across set_materialized_only
--        (CREATE OR REPLACE VIEW must not drop permissions)
-- ============================================================
\echo '=== RT-19: GRANT preserved ==='
=== RT-19: GRANT preserved ===
CREATE ROLE ts_reader;
NOTICE:  resource queue required -- using default resource queue "pg_default"
GRANT SELECT ON cv TO ts_reader;
-- Record ACL before toggle
SELECT relacl::text LIKE '%ts_reader%' AS has_grant_before
  FROM pg_class WHERE relname = 'cv';
 has_grant_before 
------------------
 t
(1 row)

ALTER VIEW cv SET (time_series.materialized_only = true);
SELECT relacl::text LIKE '%ts_reader%' AS has_grant_after_mo
  FROM pg_class WHERE relname = 'cv';
 has_grant_after_mo 
--------------------
 t
(1 row)

ALTER VIEW cv SET (time_series.materialized_only = false);
SELECT relacl::text LIKE '%ts_reader%' AS has_grant_after_rt
  FROM pg_class WHERE relname = 'cv';
 has_grant_after_rt 
--------------------
 t
(1 row)

REVOKE SELECT ON cv FROM ts_reader;
DROP ROLE ts_reader;
-- ============================================================
-- RT-20: EXPLAIN plan shape differs between modes
--
-- Real-time mode: plan contains an Append node with two branches
-- (mat table Seq Scan + direct view HashAggregate on source).
-- Materialized-only mode: single Seq Scan on mat table, no Append.
-- ============================================================
\echo '=== RT-20: EXPLAIN plan shape ==='
=== RT-20: EXPLAIN plan shape ===
CREATE TABLE m_plan (time TIMESTAMPTZ NOT NULL, v INT NOT NULL, val FLOAT8)
  DISTRIBUTED BY (v);
INSERT INTO m_plan VALUES ('2024-01-01 01:00+00', 1, 10.0);
CREATE MATERIALIZED VIEW cv_plan
WITH (time_series.continuous) AS
  SELECT time_bucket('1 hour'::interval, time) AS bucket, count(*) AS cnt
  FROM m_plan GROUP BY bucket;
NOTICE:  continuous aggregate "cv_plan" successfully created
DETAIL:  Materialization table: time_series._mat_cv_plan_8
-- Real-time: plan should show Append with two branches
-- Use DO block to capture EXPLAIN output and check for expected nodes
DO $$
DECLARE
    plan_text text := '';
    line text;
    has_append bool := false;
    has_mat_scan bool := false;
    has_hashagg bool := false;
BEGIN
    FOR line IN
        EXECUTE 'EXPLAIN (costs off, timing off, summary off) SELECT * FROM cv_plan'
    LOOP
        plan_text := plan_text || line || E'\n';
        IF line LIKE '%Append%' THEN has_append := true; END IF;
        IF line LIKE '%Seq Scan on _mat_cv_plan%' THEN has_mat_scan := true; END IF;
        IF line LIKE '%HashAggregate%' THEN has_hashagg := true; END IF;
    END LOOP;
    RAISE NOTICE 'rt_plan: append=% mat_scan=% hashagg=%',
                 has_append, has_mat_scan, has_hashagg;
END $$;
NOTICE:  rt_plan: append=t mat_scan=t hashagg=t
ALTER VIEW cv_plan SET (time_series.materialized_only = true);
-- Mat-only: plan should NOT contain Append or HashAggregate
DO $$
DECLARE
    line text;
    has_append bool := false;
    has_mat_scan bool := false;
    has_hashagg bool := false;
BEGIN
    FOR line IN
        EXECUTE 'EXPLAIN (costs off, timing off, summary off) SELECT * FROM cv_plan'
    LOOP
        IF line LIKE '%Append%' THEN has_append := true; END IF;
        IF line LIKE '%Seq Scan on _mat_cv_plan%' THEN has_mat_scan := true; END IF;
        IF line LIKE '%HashAggregate%' THEN has_hashagg := true; END IF;
    END LOOP;
    RAISE NOTICE 'mo_plan: append=% mat_scan=% hashagg=%',
                 has_append, has_mat_scan, has_hashagg;
END $$;
NOTICE:  mo_plan: append=f mat_scan=t hashagg=f
DROP VIEW cv_plan CASCADE;
DROP TABLE m_plan CASCADE;
-- ============================================================
-- RT-21: Re-aggregation over user view
--        Most common analytics pattern: aggregate further over CAGG
--        output. Verifies user view works as a first-class view in
--        user queries, with UNION ALL transparently composing.
-- ============================================================
\echo '=== RT-21: re-aggregation over user view ==='
=== RT-21: re-aggregation over user view ===
-- Ensure cv is in real-time mode and fully refreshed
ALTER VIEW cv SET (time_series.materialized_only = false);
CALL time_series.refresh_continuous_aggregate('cv', NULL, NULL);
-- Move watermark back so half the data is in mat, half in real-time (scope to cv)
UPDATE time_series.cagg_watermark
   SET watermark = '2024-01-01 05:00:00+00'::timestamptz
 WHERE cagg_id = (SELECT cagg_id FROM time_series.continuous_agg
                  WHERE user_view_name = 'cv');
-- sum(cnt) per tag should match count(*) from source per tag
SELECT count(*) AS diff_rt21 FROM (
  (  SELECT tags_id, sum(cnt)::bigint AS total
   FROM cv GROUP BY tags_id
   EXCEPT
   SELECT tags_id, count(*)::bigint
   FROM metrics GROUP BY tags_id)
  UNION ALL
  (SELECT tags_id, count(*)::bigint
   FROM metrics GROUP BY tags_id
   EXCEPT
   SELECT tags_id, sum(cnt)::bigint AS total
   FROM cv GROUP BY tags_id
   )
) x;
 diff_rt21 
-----------
         0
(1 row)

-- ============================================================
-- RT-22: Window function over user view
--        Time-series 标志性查询：bucket-over-bucket lag/diff.
--        Verifies that user view (UNION ALL) is usable with window
--        functions across the watermark split.
-- ============================================================
\echo '=== RT-22: window function over user view ==='
=== RT-22: window function over user view ===
WITH cv_lagged AS (
  SELECT bucket, tags_id, cnt,
         lag(cnt) OVER (PARTITION BY tags_id ORDER BY bucket) AS prev_cnt
    FROM cv
   WHERE tags_id = 1
)
SELECT count(*) AS rows_with_lag,
       count(*) FILTER (WHERE prev_cnt IS NULL) AS first_bucket_per_tag
FROM cv_lagged;
 rows_with_lag | first_bucket_per_tag 
---------------+----------------------
            10 |                    1
(1 row)

-- 10 buckets for tag=1, first has prev_cnt=NULL, others have prev_cnt=10
-- Expected: rows_with_lag=10, first_bucket_per_tag=1
-- ============================================================
-- RT-23: ALTER VIEW DDL syntax for mode toggle (the only public API)
--        The mode-toggle PROCEDURE was removed: ALTER VIEW is the
--        single user-facing interface.  The hook handles the option
--        in C; see cagg_create.c:cagg_apply_materialized_only.
-- ============================================================
\echo '=== RT-23: ALTER VIEW DDL syntax ==='
=== RT-23: ALTER VIEW DDL syntax ===
-- Ensure starting state: real-time
ALTER VIEW cv SET (time_series.materialized_only = false);
SELECT materialized_only AS mo_start FROM time_series.continuous_agg
 WHERE user_view_name = 'cv';
 mo_start 
----------
 f
(1 row)

-- Switch to mat-only
ALTER VIEW cv SET (time_series.materialized_only = true);
SELECT materialized_only AS mo_after_alter_true FROM time_series.continuous_agg
 WHERE user_view_name = 'cv';
 mo_after_alter_true 
---------------------
 t
(1 row)

SELECT pg_get_viewdef('cv', true) LIKE '%UNION ALL%' AS has_union_after_alter;
 has_union_after_alter 
-----------------------
 f
(1 row)

-- Switch back to real-time
ALTER VIEW cv SET (time_series.materialized_only = false);
SELECT materialized_only AS mo_after_alter_false FROM time_series.continuous_agg
 WHERE user_view_name = 'cv';
 mo_after_alter_false 
----------------------
 f
(1 row)

SELECT pg_get_viewdef('cv', true) LIKE '%UNION ALL%' AS has_union_restored;
 has_union_restored 
--------------------
 t
(1 row)

-- Non-CAGG view: our hook should not intercept; PG's native reloption
-- validation rejects unknown namespaced options on regular views.
CREATE VIEW ordinary_view AS SELECT 1 AS x;
\set ON_ERROR_STOP 0
ALTER VIEW ordinary_view SET (time_series.materialized_only = true);
ERROR:  unrecognized parameter namespace "time_series"
\set ON_ERROR_STOP 1
DROP VIEW ordinary_view;
-- The removed procedure should no longer exist
\set ON_ERROR_STOP 0
CALL time_series.set_materialized_only('cv', true);
ERROR:  procedure time_series.set_materialized_only(unknown, boolean) does not exist
LINE 1: CALL time_series.set_materialized_only('cv', true);
             ^
HINT:  No procedure matches the given name and argument types. You might need to add explicit type casts.
\set ON_ERROR_STOP 1
-- ============================================================
-- TSDB alignment: query/view tests
-- ============================================================
-- ============================================================
-- RT-24: Complex WHERE + HAVING + expressions in union view
--        (TSDB cagg_union_view.sql.in: sum(b+c), max-min, HAVING)
-- ============================================================
\echo '=== RT-24: complex WHERE+HAVING ==='
=== RT-24: complex WHERE+HAVING ===
CREATE TABLE wh_src (time TIMESTAMPTZ NOT NULL, loc TEXT, b INT, c INT)
  DISTRIBUTED BY (loc);
INSERT INTO wh_src VALUES
  ('2024-01-01 00:10+00', 'NYC', 10, 20),
  ('2024-01-01 00:20+00', 'NYC', 14, 30),
  ('2024-01-01 00:30+00', 'SFO', 16, 40),
  ('2024-01-01 01:10+00', 'NYC', 12, 25),
  ('2024-01-01 01:20+00', 'NYC', 8, 15);
CREATE MATERIALIZED VIEW cv_wh
WITH (time_series.continuous) AS
  SELECT time_bucket('1 hour'::interval, time) AS bucket, loc,
         sum(b + c) AS sbc, max(c) - min(b) AS spread
  FROM wh_src WHERE b < 16
  GROUP BY bucket, loc
  HAVING sum(c) > 10;
NOTICE:  continuous aggregate "cv_wh" successfully created
DETAIL:  Materialization table: time_series._mat_cv_wh_9
-- Real-time (before REFRESH)
SELECT count(*) AS diff_wh_rt FROM (
  (  SELECT bucket, loc, sbc, spread FROM cv_wh
   EXCEPT
   SELECT time_bucket('1 hour'::interval, time), loc,
   sum(b + c), max(c) - min(b)
   FROM wh_src WHERE b < 16
   GROUP BY 1, 2 HAVING sum(c) > 10)
  UNION ALL
  (SELECT time_bucket('1 hour'::interval, time), loc,
   sum(b + c), max(c) - min(b)
   FROM wh_src WHERE b < 16
   GROUP BY 1, 2 HAVING sum(c) > 10
   EXCEPT
   SELECT bucket, loc, sbc, spread FROM cv_wh
   )
) x;
 diff_wh_rt 
------------
          0
(1 row)

-- After REFRESH
CALL time_series.refresh_continuous_aggregate('cv_wh', NULL, NULL);
SELECT count(*) AS diff_wh_mat FROM (
  (  SELECT bucket, loc, sbc, spread FROM cv_wh
   EXCEPT
   SELECT time_bucket('1 hour'::interval, time), loc,
   sum(b + c), max(c) - min(b)
   FROM wh_src WHERE b < 16
   GROUP BY 1, 2 HAVING sum(c) > 10)
  UNION ALL
  (SELECT time_bucket('1 hour'::interval, time), loc,
   sum(b + c), max(c) - min(b)
   FROM wh_src WHERE b < 16
   GROUP BY 1, 2 HAVING sum(c) > 10
   EXCEPT
   SELECT bucket, loc, sbc, spread FROM cv_wh
   )
) x;
 diff_wh_mat 
-------------
           0
(1 row)

-- Insert after watermark → union catches new data
INSERT INTO wh_src VALUES ('2024-01-01 02:10+00', 'NYC', 13, 60);
SELECT count(*) AS diff_wh_live FROM (
  (  SELECT bucket, loc, sbc, spread FROM cv_wh
   EXCEPT
   SELECT time_bucket('1 hour'::interval, time), loc,
   sum(b + c), max(c) - min(b)
   FROM wh_src WHERE b < 16
   GROUP BY 1, 2 HAVING sum(c) > 10)
  UNION ALL
  (SELECT time_bucket('1 hour'::interval, time), loc,
   sum(b + c), max(c) - min(b)
   FROM wh_src WHERE b < 16
   GROUP BY 1, 2 HAVING sum(c) > 10
   EXCEPT
   SELECT bucket, loc, sbc, spread FROM cv_wh
   )
) x;
 diff_wh_live 
--------------
            0
(1 row)

DROP TABLE wh_src CASCADE;
NOTICE:  drop cascades to 3 other objects
DETAIL:  drop cascades to view _partial_view_9
drop cascades to view _direct_view_9
drop cascades to view cv_wh
NOTICE:  view "cv_wh" does not exist, skipping
-- ============================================================
-- RT-25: TIMESTAMP (without timezone) type
--        (TSDB cagg_union_view.sql.in: timestamp_table)
-- ============================================================
\echo '=== RT-25: TIMESTAMP no tz ==='
=== RT-25: TIMESTAMP no tz ===
CREATE TABLE ts_src (time TIMESTAMP NOT NULL, v INT NOT NULL, val FLOAT8)
  DISTRIBUTED BY (v);
INSERT INTO ts_src VALUES
  ('2024-01-01 00:30', 1, 10.0),
  ('2024-01-01 01:30', 2, 20.0),
  ('2024-01-01 02:30', 3, 30.0);
CREATE MATERIALIZED VIEW cv_ts
WITH (time_series.continuous) AS
  SELECT time_bucket('1 hour'::interval, time) AS bucket,
         count(*) AS cnt, avg(val) AS a
  FROM ts_src GROUP BY bucket;
NOTICE:  continuous aggregate "cv_ts" successfully created
DETAIL:  Materialization table: time_series._mat_cv_ts_10
-- Real-time before REFRESH
SELECT count(*) AS diff_ts_rt FROM (
  (  SELECT bucket, cnt, a FROM cv_ts
   EXCEPT
   SELECT time_bucket('1 hour'::interval, time), count(*), avg(val)
   FROM ts_src GROUP BY 1)
  UNION ALL
  (SELECT time_bucket('1 hour'::interval, time), count(*), avg(val)
   FROM ts_src GROUP BY 1
   EXCEPT
   SELECT bucket, cnt, a FROM cv_ts
   )
) x;
 diff_ts_rt 
------------
          0
(1 row)

-- After REFRESH
CALL time_series.refresh_continuous_aggregate('cv_ts', NULL, NULL);
SELECT count(*) AS diff_ts_mat FROM (
  (  SELECT bucket, cnt, a FROM cv_ts
   EXCEPT
   SELECT time_bucket('1 hour'::interval, time), count(*), avg(val)
   FROM ts_src GROUP BY 1)
  UNION ALL
  (SELECT time_bucket('1 hour'::interval, time), count(*), avg(val)
   FROM ts_src GROUP BY 1
   EXCEPT
   SELECT bucket, cnt, a FROM cv_ts
   )
) x;
 diff_ts_mat 
-------------
           0
(1 row)

DROP TABLE ts_src CASCADE;
NOTICE:  drop cascades to 3 other objects
DETAIL:  drop cascades to view _partial_view_10
drop cascades to view _direct_view_10
drop cascades to view cv_ts
NOTICE:  view "cv_ts" does not exist, skipping
-- ============================================================
-- RT-26: cagg_watermark() with invalid/NULL input
--        (TSDB cagg_union_view.sql.in: error handling)
--        Aligned with TSDB: fail-fast on missing watermark.
-- ============================================================
\echo '=== RT-26: watermark invalid input ==='
=== RT-26: watermark invalid input ===
-- Non-existing ID on QD → returns -infinity (QD has no RANDOMLY rows)
-- On segment QE, this would ERROR (fail-fast, same as TSDB).
SELECT cagg_watermark(99999) AS wm_invalid;
 wm_invalid 
------------
 -infinity
(1 row)

-- NULL → ERROR
\set ON_ERROR_STOP 0
SELECT cagg_watermark(NULL::int);
ERROR:  continuous aggregate ID cannot be NULL
\set ON_ERROR_STOP 1
-- ============================================================
-- RT-27: AT TIME ZONE in CAGG aggregate expression
--        (TSDB cagg_usage-17.sql: timezone handling)
-- ============================================================
\echo '=== RT-27: AT TIME ZONE ==='
=== RT-27: AT TIME ZONE ===
CREATE TABLE tz_src (time TIMESTAMPTZ NOT NULL, v INT NOT NULL, temp FLOAT8)
  DISTRIBUTED BY (v);
INSERT INTO tz_src VALUES
  ('2024-01-01 00:30+00', 1, 55.0),
  ('2024-01-01 05:30+00', 2, 65.0);
CREATE MATERIALIZED VIEW cv_atz
WITH (time_series.continuous) AS
  SELECT time_bucket('1 hour'::interval, time) AS bucket,
         min(time AT TIME ZONE 'EST') AS min_est,
         avg(temp) AS avg_temp
  FROM tz_src GROUP BY bucket;
NOTICE:  continuous aggregate "cv_atz" successfully created
DETAIL:  Materialization table: time_series._mat_cv_atz_11
CALL time_series.refresh_continuous_aggregate('cv_atz', NULL, NULL);
SELECT count(*) AS diff_atz FROM (
  (  SELECT bucket, min_est, avg_temp FROM cv_atz
   EXCEPT
   SELECT time_bucket('1 hour'::interval, time),
   min(time AT TIME ZONE 'EST'), avg(temp)
   FROM tz_src GROUP BY 1)
  UNION ALL
  (SELECT time_bucket('1 hour'::interval, time),
   min(time AT TIME ZONE 'EST'), avg(temp)
   FROM tz_src GROUP BY 1
   EXCEPT
   SELECT bucket, min_est, avg_temp FROM cv_atz
   )
) x;
 diff_atz 
----------
        0
(1 row)

DROP TABLE tz_src CASCADE;
NOTICE:  drop cascades to 3 other objects
DETAIL:  drop cascades to view _partial_view_11
drop cascades to view _direct_view_11
drop cascades to view cv_atz
NOTICE:  view "cv_atz" does not exist, skipping
-- ============================================================
-- RT-28: time_bucket with timezone parameter
--        (TSDB cagg_usage-17.sql: 3-arg timezone form)
-- ============================================================
\echo '=== RT-28: time_bucket timezone param ==='
=== RT-28: time_bucket timezone param ===
CREATE TABLE tbtz_src (time TIMESTAMPTZ NOT NULL, v INT NOT NULL, val FLOAT8)
  DISTRIBUTED BY (v);
INSERT INTO tbtz_src VALUES
  ('2024-01-01 00:30+00', 1, 10.0),
  ('2024-01-01 12:30+00', 2, 20.0),
  ('2024-01-02 00:30+00', 3, 30.0);
CREATE MATERIALIZED VIEW cv_tbtz
WITH (time_series.continuous) AS
  SELECT time_bucket('1 day'::interval, time, 'America/New_York') AS bucket,
         count(*) AS cnt
  FROM tbtz_src GROUP BY bucket;
NOTICE:  continuous aggregate "cv_tbtz" successfully created
DETAIL:  Materialization table: time_series._mat_cv_tbtz_12
CALL time_series.refresh_continuous_aggregate('cv_tbtz', NULL, NULL);
SELECT count(*) AS diff_tbtz FROM (
  (  SELECT bucket, cnt FROM cv_tbtz
   EXCEPT
   SELECT time_bucket('1 day'::interval, time, 'America/New_York'), count(*)
   FROM tbtz_src GROUP BY 1)
  UNION ALL
  (SELECT time_bucket('1 day'::interval, time, 'America/New_York'), count(*)
   FROM tbtz_src GROUP BY 1
   EXCEPT
   SELECT bucket, cnt FROM cv_tbtz
   )
) x;
 diff_tbtz 
-----------
         0
(1 row)

DROP TABLE tbtz_src CASCADE;
NOTICE:  drop cascades to 3 other objects
DETAIL:  drop cascades to view _partial_view_12
drop cascades to view _direct_view_12
drop cascades to view cv_tbtz
NOTICE:  view "cv_tbtz" does not exist, skipping
-- ============================================================
-- RT-29: CAGG vs regular VIEW equivalence
--        (TSDB cagg_query_common.sql: compare CAGG output
--         against a plain VIEW with identical definition)
-- ============================================================
\echo '=== RT-29: CAGG vs VIEW equivalence ==='
=== RT-29: CAGG vs VIEW equivalence ===
ALTER VIEW cv SET (time_series.materialized_only = false);
CALL time_series.refresh_continuous_aggregate('cv', NULL, NULL);
CREATE VIEW plain_oracle AS
  SELECT time_bucket('1 hour'::interval, time) AS bucket,
         tags_id, count(*) AS cnt, avg(temperature) AS avg_temp
  FROM metrics GROUP BY bucket, tags_id;
-- CAGG output should match plain VIEW exactly
SELECT count(*) AS diff_cv_vs_view FROM (
  (  SELECT bucket, tags_id, cnt, round(avg_temp::numeric, 10) FROM cv
   EXCEPT
   SELECT bucket, tags_id, cnt, round(avg_temp::numeric, 10) FROM plain_oracle)
  UNION ALL
  (SELECT bucket, tags_id, cnt, round(avg_temp::numeric, 10) FROM plain_oracle
   EXCEPT
   SELECT bucket, tags_id, cnt, round(avg_temp::numeric, 10) FROM cv
   )
) x;
 diff_cv_vs_view 
-----------------
               0
(1 row)

-- Reverse direction too
SELECT count(*) AS diff_view_vs_cv FROM (
  (  SELECT bucket, tags_id, cnt, round(avg_temp::numeric, 10) FROM plain_oracle
   EXCEPT
   SELECT bucket, tags_id, cnt, round(avg_temp::numeric, 10) FROM cv)
  UNION ALL
  (SELECT bucket, tags_id, cnt, round(avg_temp::numeric, 10) FROM cv
   EXCEPT
   SELECT bucket, tags_id, cnt, round(avg_temp::numeric, 10) FROM plain_oracle
   )
) x;
 diff_view_vs_cv 
-----------------
               0
(1 row)

DROP VIEW plain_oracle;
-- ============================================================
-- RT-30: Stale-then-fresh for specific cell
--        (TSDB cagg_usage-17.sql: observe old value before refresh,
--         new value after refresh for same bucket+tag)
-- ============================================================
\echo '=== RT-30: stale then fresh ==='
=== RT-30: stale then fresh ===
CALL time_series.refresh_continuous_aggregate('cv', NULL, NULL);
-- Record current value for (bucket=01:00, tags_id=1)
ALTER VIEW cv SET (time_series.materialized_only = true);
SELECT cnt AS cnt_before_backfill FROM cv
WHERE bucket = '2024-01-01 01:00+00' AND tags_id = 1;
 cnt_before_backfill 
---------------------
                  10
(1 row)

-- Backfill: add a row to same bucket
INSERT INTO metrics VALUES ('2024-01-01 01:45+00', 1, 99.0);
-- mat-only still shows OLD value (stale)
SELECT cnt AS cnt_stale FROM cv
WHERE bucket = '2024-01-01 01:00+00' AND tags_id = 1;
 cnt_stale 
-----------
        10
(1 row)

-- REFRESH then verify NEW value
ALTER VIEW cv SET (time_series.materialized_only = false);
CALL time_series.refresh_continuous_aggregate('cv',
  '2024-01-01 01:00+00', '2024-01-01 02:00+00');
ALTER VIEW cv SET (time_series.materialized_only = true);
SELECT cnt AS cnt_fresh FROM cv
WHERE bucket = '2024-01-01 01:00+00' AND tags_id = 1;
 cnt_fresh 
-----------
        11
(1 row)

ALTER VIEW cv SET (time_series.materialized_only = false);
-- ============================================================
-- RT-32: ::timestamp cast in CAGG definition → rejected
--        (TSDB pre-PG17 behavior: reject STABLE expressions)
--
--   time_bucket(...)::timestamp is a STABLE expression because
--   timestamptz→timestamp conversion depends on session timezone.
--   If allowed, REFRESH in one timezone + query in another would
--   cause data loss in the UNION ALL view.
-- ============================================================
\echo '=== RT-32: reject STABLE expression ==='
=== RT-32: reject STABLE expression ===
CREATE TABLE tz_cast (time TIMESTAMPTZ NOT NULL, device INT NOT NULL, temp FLOAT8)
  DISTRIBUTED BY (device);
SET timezone = 'UTC';
\set ON_ERROR_STOP 0
-- ::timestamp cast is STABLE → should be rejected
CREATE MATERIALIZED VIEW cv_tzcast
WITH (time_series.continuous) AS
  SELECT time_bucket('1 hour'::interval, time)::timestamp AS bucket,
         device, avg(temp) AS avg_temp
  FROM tz_cast
  GROUP BY time_bucket('1 hour'::interval, time), device;
ERROR:  continuous aggregate SELECT expression contains a mutable (non-IMMUTABLE) function
HINT:  Expressions like '::timestamp' depend on session settings (e.g. timezone) and would produce inconsistent results between materialized and real-time branches. Use timestamptz instead.
\set ON_ERROR_STOP 1
DROP TABLE tz_cast CASCADE;
-- ============================================================
-- RT-31: DELETE watermark → graceful degradation → restore
--        (TSDB cagg_union_view.sql.in lines 468-528)
--
--   TSDB behavior: DELETE watermark → query ERROR, REFRESH ERROR.
--   Our behavior:  DELETE watermark → cagg_watermark() returns
--   -infinity (fallback), query degrades to full real-time
--   aggregation (mat branch empty, live branch = all source).
--   REFRESH also works (unified path from -infinity).
-- ============================================================
\echo '=== RT-31: watermark delete + restore ==='
=== RT-31: watermark delete + restore ===
CALL time_series.refresh_continuous_aggregate('cv', NULL, NULL);
-- Baseline: fully materialized
ALTER VIEW cv SET (time_series.materialized_only = true);
SELECT count(*) AS mat_before_wm_del FROM cv;
 mat_before_wm_del 
-------------------
               100
(1 row)

ALTER VIEW cv SET (time_series.materialized_only = false);
-- Delete ALL watermark rows for this CAGG
DELETE FROM time_series.cagg_watermark
WHERE cagg_id = (SELECT cagg_id FROM time_series.continuous_agg
                 WHERE user_view_name = 'cv');
-- Query should ERROR: watermark not found (fail-fast, same as TSDB)
\set ON_ERROR_STOP 0
SELECT count(*) FROM cv;
ERROR:  watermark not found for continuous aggregate 1 (cagg_insert.c:834)  (seg2 slice1 172.19.0.2:7004 pid=96392) (cagg_insert.c:834)
HINT:  The watermark catalog may be corrupted. Re-create the watermark rows using _cagg_init_segment_watermark().
\set ON_ERROR_STOP 1
-- REFRESH should also ERROR (watermark lookup fails during refresh)
\set ON_ERROR_STOP 0
CALL time_series.refresh_continuous_aggregate('cv', NULL, NULL);
ERROR:  watermark not found for continuous aggregate 1 (cagg_refresh.c:828)
HINT:  The watermark catalog may be corrupted. Re-create the watermark rows using _cagg_init_segment_watermark().
\set ON_ERROR_STOP 1
-- Manual restore: re-create watermark rows (one per segment)
-- This is the workaround for catalog corruption.
DO $$
DECLARE
  cid int;
BEGIN
  SELECT cagg_id INTO cid FROM time_series.continuous_agg
  WHERE user_view_name = 'cv';
  -- Use _cagg_init_segment_watermark to recreate per-segment rows
  PERFORM time_series._cagg_init_segment_watermark(cid)
  FROM gp_dist_random('gp_id');
END $$;
-- Watermark now exists again
SELECT count(*) > 0 AS wm_manually_restored
FROM time_series.cagg_watermark
WHERE cagg_id = (SELECT cagg_id FROM time_series.continuous_agg
                 WHERE user_view_name = 'cv');
 wm_manually_restored 
----------------------
 t
(1 row)

-- REFRESH to advance watermark to proper value
CALL time_series.refresh_continuous_aggregate('cv', NULL, NULL);
-- Mat-only mode now returns correct data (watermark restored)
ALTER VIEW cv SET (time_series.materialized_only = true);
SELECT count(*) AS mat_after_full_restore FROM cv;
 mat_after_full_restore 
------------------------
                    100
(1 row)

ALTER VIEW cv SET (time_series.materialized_only = false);
-- Final correctness check (both directions)
SELECT count(*) AS diff_restored_1 FROM (
  (  SELECT bucket, tags_id, cnt, round(avg_temp::numeric, 10) FROM cv
   EXCEPT
   SELECT time_bucket('1 hour'::interval, time), tags_id,
   count(*), round(avg(temperature)::numeric, 10)
   FROM metrics GROUP BY 1, 2)
  UNION ALL
  (SELECT time_bucket('1 hour'::interval, time), tags_id,
   count(*), round(avg(temperature)::numeric, 10)
   FROM metrics GROUP BY 1, 2
   EXCEPT
   SELECT bucket, tags_id, cnt, round(avg_temp::numeric, 10) FROM cv
   )
) x;
 diff_restored_1 
-----------------
               0
(1 row)

SELECT count(*) AS diff_restored_2 FROM (
  (  SELECT time_bucket('1 hour'::interval, time), tags_id,
   count(*), round(avg(temperature)::numeric, 10)
   FROM metrics GROUP BY 1, 2
   EXCEPT
   SELECT bucket, tags_id, cnt, round(avg_temp::numeric, 10) FROM cv)
  UNION ALL
  (SELECT bucket, tags_id, cnt, round(avg_temp::numeric, 10) FROM cv
   EXCEPT
   SELECT time_bucket('1 hour'::interval, time), tags_id,
   count(*), round(avg(temperature)::numeric, 10)
   FROM metrics GROUP BY 1, 2
   )
) x;
 diff_restored_2 
-----------------
               0
(1 row)

-- ============================================================
-- Cleanup
-- ============================================================
DROP TABLE metrics CASCADE;
NOTICE:  drop cascades to 3 other objects
DETAIL:  drop cascades to view _partial_view_1
drop cascades to view _direct_view_1
drop cascades to view cv
NOTICE:  view "cv" does not exist, skipping
\echo '=== REALTIME TESTS DONE ==='
=== REALTIME TESTS DONE ===
